{
  "type": "statblock",
  "name": "HUMAN BANDIT CHIEF",
  "level": 3,
  "role": "",
  "organization": "LEADER",
  "keywords": [
    "Human",
    "Humanoid"
  ],
  "ev": "20",
  "stamina": "120",
  "immunities": [
    "Corruption 4",
    "Psychic 4"
  ],
  "speed": 5,
  "size": "1 M",
  "stability": 2,
  "free_strike": 5,
  "might": 2,
  "agility": 3,
  "reason": 2,
  "intuition": 3,
  "presence": 2,
  "features": [
    {
      "type": "feature",
      "feature_type": "trait",
      "name": "End Effect",
      "icon": "⭐️",
      "effects": [
        {
          "effect": "At the end of their turn, the bandit chief can take 5 damage to end one save ends effect affecting them. This damage can’t be reduced in any way."
        }
      ]
    },
    {
      "type": "feature",
      "feature_type": "trait",
      "name": "Supernatural Insight",
      "icon": "⭐️",
      "effects": [
        {
          "effect": "The bandit chief ignores concealment if it’s granted by a supernatural effect, or the target is supernatural."
        }
      ]
    },
    {
      "type": "feature",
      "feature_type": "ability",
      "name": "Whip & Magic Longsword",
      "icon": "🗡",
      "ability_type": "Signature Ability",
      "keywords": [
        "Magic",
        "Melee",
        "Strike",
        "Weapon"
      ],
      "usage": "Main action",
      "distance": "Melee 3",
      "target": "Two enemies or objects",
      "effects": [
        {
          "roll": "Power Roll + 3",
          "tier1": "8 damage; pull 1",
          "tier2": "12 damage; pull 2",
          "tier3": "15 damage; pull 3"
        },
        {
          "name": "Effect",
          "effect": "A target who is adjacent to the bandit chief after the ability resolves takes 5 corruption damage."
        },
        {
          "cost": "2 Malice",
          "effect": "The bandit chief targets an additional enemy or object."
        }
      ]
    },
    {
      "type": "feature",
      "feature_type": "ability",
      "name": "Kneel, Peasant!",
      "icon": "🗡",
      "keywords": [
        "Melee",
        "Weapon"
      ],
      "usage": "Maneuver",
      "distance": "Melee 1",
      "target": "One enemy or object",
      "effects": [
        {
          "roll": "Power Roll + 3",
          "tier1": "Push 1; M<1 prone",
          "tier2": "Push 2; M<2 prone",
          "tier3": "Push 4; M<3 prone"
        },
        {
          "cost": "2 Malice",
          "effect": "This ability targets each enemy adjacent to the bandit chief."
        }
      ]
    },
    {
      "type": "feature",
      "feature_type": "ability",
      "name": "Bloodstones",
      "icon": "❗️",
      "keywords": [
        "Magic"
      ],
      "usage": "Triggered action",
      "distance": "Self",
      "target": "Self",
      "trigger": "The bandit chief makes a power roll.",
      "effects": [
        {
          "name": "Effect",
          "effect": "The bandit chief takes 4 corruption damage and increases the result of the power roll by one tier."
        }
      ]
    },
    {
      "type": "feature",
      "feature_type": "ability",
      "name": "Shoot!",
      "icon": "☠️",
      "ability_type": "Villain Action 1",
      "keywords": [
        "Area"
      ],
      "usage": "-",
      "distance": "10 burst",
      "target": "All allies in the burst",
      "effects": [
        {
          "name": "Effect",
          "effect": "Each target makes a ranged free strike."
        }
      ]
    },
    {
      "type": "feature",
      "feature_type": "ability",
      "name": "Form Up!",
      "icon": "☠️",
      "ability_type": "Villain Action 2",
      "keywords": [
        "Area"
      ],
      "usage": "-",
      "distance": "10 burst",
      "target": "All allies in the burst",
      "effects": [
        {
          "name": "Effect",
          "effect": "Each target shifts up to their speed. Until the end of the encounter, the bandit chief and all allies have damage immunity 2 while adjacent to a target."
        }
      ]
    },
    {
      "type": "feature",
      "feature_type": "ability",
      "name": "Lead From the Front",
      "icon": "☠️",
      "ability_type": "Villain Action 3",
      "keywords": [
        "—"
      ],
      "usage": "-",
      "distance": "Self",
      "target": "Self",
      "effects": [
        {
          "name": "Effect",
          "effect": "Shift 10. During or after this movement, the bandit chief can use their Whip & Magic Longsword against up to four targets. Each ally adjacent to a target can make a free strike against them."
        }
      ]
    }
  ]
}
