{
  "type": "statblock",
  "name": "GOBLIN SNIPER",
  "level": 1,
  "role": "ARTILLERY",
  "organization": "MINION",
  "keywords": [
    "Goblin",
    "Humanoid"
  ],
  "ev": "3 for four minions",
  "stamina": "3",
  "speed": 5,
  "movement": "climb",
  "size": "1S",
  "stability": 0,
  "free_strike": 2,
  "with_captain": "Ranged distance +5",
  "might": -2,
  "agility": 2,
  "reason": 0,
  "intuition": 0,
  "presence": -1,
  "features": [
    {
      "type": "feature",
      "feature_type": "trait",
      "name": "Crafty",
      "icon": "⭐️",
      "effects": [
        {
          "effect": "The sniper doesn’t provoke opportunity attacks by moving."
        }
      ]
    },
    {
      "type": "feature",
      "feature_type": "ability",
      "name": "Bow",
      "icon": "🏹",
      "ability_type": "Signature Ability",
      "keywords": [
        "Ranged",
        "Strike",
        "Weapon"
      ],
      "usage": "Main action",
      "distance": "Ranged 10",
      "target": "One creature or object per minion",
      "effects": [
        {
          "roll": "Power Roll + 2",
          "tier1": "2 damage",
          "tier2": "4 damage",
          "tier3": "5 damage"
        },
        {
          "name": "Effect",
          "effect": "If the sniper doesn’t use a move action this turn, the ability has an edge."
        }
      ]
    }
  ]
}
