{
  "type": "statblock",
  "name": "GOBLIN ASSASSIN",
  "level": 1,
  "role": "AMBUSHER",
  "organization": "HORDE",
  "keywords": [
    "Goblin",
    "Humanoid"
  ],
  "ev": "3",
  "stamina": "15",
  "speed": 6,
  "movement": "climb",
  "size": "1S",
  "stability": 0,
  "free_strike": 2,
  "might": -2,
  "agility": 2,
  "reason": 0,
  "intuition": 0,
  "presence": -2,
  "features": [
    {
      "type": "feature",
      "feature_type": "trait",
      "name": "Crafty",
      "icon": "⭐️",
      "effects": [
        {
          "effect": "The assassin doesn’t provoke opportunity attacks by moving."
        }
      ]
    },
    {
      "type": "feature",
      "feature_type": "trait",
      "name": "Slip Away",
      "icon": "⭐️",
      "effects": [
        {
          "effect": "The assassin can take the Hide maneuver even while observed."
        }
      ]
    },
    {
      "type": "feature",
      "feature_type": "ability",
      "name": "Sword Stab",
      "icon": "🗡",
      "ability_type": "Signature Ability",
      "keywords": [
        "Melee",
        "Strike",
        "Weapon"
      ],
      "usage": "Main action",
      "distance": "Melee 1",
      "target": "One creature or object",
      "effects": [
        {
          "roll": "Power Roll + 2",
          "tier1": "4 damage",
          "tier2": "6 damage",
          "tier3": "7 damage"
        },
        {
          "name": "Effect",
          "effect": "This ability deals an additional 2 damage if the assassin has an edge on the power roll."
        }
      ]
    },
    {
      "type": "feature",
      "feature_type": "ability",
      "name": "Shadow Chains",
      "icon": "🏹",
      "cost": "3 Malice",
      "keywords": [
        "Magic",
        "Ranged"
      ],
      "usage": "Main action",
      "distance": "Ranged 10",
      "target": "Three creatures",
      "effects": [
        {
          "roll": "Power Roll + 2",
          "tier1": "2 corruption damage; A<0 restrained (save ends)",
          "tier2": "4 corruption damage; A<1 restrained (save ends)",
          "tier3": "5 corruption damage; A<2 restrained (save ends)"
        }
      ]
    }
  ]
}
