{
  "type": "statblock",
  "name": "GOBLIN BATTLEBORN",
  "level": 2,
  "role": "BRUTE",
  "organization": "HORDE",
  "keywords": [
    "Goblin",
    "Humanoid",
    "Mystic Goblin"
  ],
  "ev": "4",
  "stamina": "25",
  "speed": 6,
  "movement": "climb",
  "size": "1L",
  "stability": 2,
  "free_strike": 5,
  "might": 2,
  "agility": 1,
  "reason": 0,
  "intuition": 1,
  "presence": 0,
  "features": [
    {
      "type": "feature",
      "feature_type": "trait",
      "name": "Cunning",
      "icon": "⭐️",
      "effects": [
        {
          "effect": "The battleborn doesn’t provoke opportunity attacks from enemies by moving. Whenever the battleborn is adjacent to an enemy and willingly moves to a space no longer adjacent to that enemy, the battleborn can make an opportunity attack against them as a triggered action."
        }
      ]
    },
    {
      "type": "feature",
      "feature_type": "ability",
      "name": "Spear Charge",
      "icon": "🗡",
      "ability_type": "Signature Ability",
      "keywords": [
        "Charge",
        "Melee",
        "Strike",
        "Weapon"
      ],
      "usage": "Main action",
      "distance": "Melee 1",
      "target": "One creature or object",
      "effects": [
        {
          "roll": "Power Roll + 2",
          "tier1": "5 damage",
          "tier2": "6 damage",
          "tier3": "8 damage; prone; the battleborn continues charging up to their speed or until they can make a free strike against another creature or object"
        }
      ]
    },
    {
      "type": "feature",
      "feature_type": "ability",
      "name": "Battle Flurry",
      "icon": "❇️",
      "cost": "3 Malice",
      "keywords": [
        "Area",
        "Melee",
        "Weapon"
      ],
      "usage": "Main action",
      "distance": "1 Burst",
      "target": "Each creature and object in the burst",
      "effects": [
        {
          "roll": "Power Roll + 2",
          "tier1": "3 damage; M<0 bleeding (save ends)",
          "tier2": "4 damage; M<1 bleeding (save ends)",
          "tier3": "5 damage; M<2 bleeding (save ends)"
        }
      ]
    }
  ]
}
