{
  "type": "statblock",
  "name": "DWARF TRAPPER",
  "level": 1,
  "role": "HARRIER",
  "organization": "PLATOON",
  "keywords": [
    "Dwarf",
    "Humanoid"
  ],
  "ev": "6",
  "stamina": "36",
  "speed": 7,
  "size": "1M",
  "stability": 2,
  "free_strike": 3,
  "might": 0,
  "agility": 2,
  "reason": 0,
  "intuition": 1,
  "presence": 0,
  "features": [
    {
      "type": "feature",
      "feature_type": "ability",
      "name": "Concussive Bolts",
      "icon": "⚔️",
      "ability_type": "Signature Ability",
      "keywords": [
        "Charge",
        "Melee",
        "Ranged",
        "Strike",
        "Weapon"
      ],
      "usage": "Main action",
      "distance": "Melee 1 or Ranged 10",
      "target": "1 creature or object",
      "effects": [
        {
          "roll": "Power Roll + 2",
          "tier1": "5 damage; push 2",
          "tier2": "7 damage; push 4",
          "tier3": "9 damage; push 6"
        },
        {
          "name": "Effect",
          "effect": "A target restrained by a dwarf can be pushed by this ability."
        }
      ]
    },
    {
      "type": "feature",
      "feature_type": "ability",
      "name": "Steam Powered Snare",
      "icon": "🔳",
      "cost": "3 Malice",
      "keywords": [
        "Area",
        "Ranged"
      ],
      "usage": "Maneuver",
      "distance": "3 cube within 5",
      "target": "All enemies in the cube",
      "effects": [
        {
          "name": "Effect",
          "effect": "Each target makes a Might test.",
          "tier1": "7 damage; restrained (EoT)",
          "tier2": "5 damage; slowed (EoT)",
          "tier3": "No effect"
        },
        {
          "name": "Effect",
          "effect": "The snare remains until the end of the encounter. An enemy that moves into an affected square for the first time on their turn must make the test."
        }
      ]
    }
  ]
}
