{
  "type": "statblock",
  "name": "RADENWIGHT MAESTRO",
  "level": 1,
  "role": "",
  "organization": "LEADER",
  "keywords": [
    "Humanoid",
    "Radenwight"
  ],
  "ev": "12",
  "stamina": "80",
  "speed": 5,
  "movement": "climb",
  "size": "1S",
  "stability": 1,
  "free_strike": 4,
  "might": -2,
  "agility": 2,
  "reason": 0,
  "intuition": 0,
  "presence": 3,
  "features": [
    {
      "type": "feature",
      "feature_type": "trait",
      "name": "End Effect",
      "icon": "⭐️",
      "effects": [
        {
          "effect": "At the end of their turn, the maestro can take 5 damage to end one save ends effect affecting them. This damage can’t be reduced in any way."
        }
      ]
    },
    {
      "type": "feature",
      "feature_type": "ability",
      "name": "Cacophony",
      "icon": "❇️",
      "ability_type": "Signature Ability",
      "keywords": [
        "Area",
        "Magic"
      ],
      "usage": "Main action",
      "distance": "5 burst",
      "target": "All enemies in the burst",
      "effects": [
        {
          "roll": "Power Roll + 3",
          "tier1": "3 sonic damage; slide 1; shift 1",
          "tier2": "6 sonic damage; slide 3; shift 3",
          "tier3": "8 sonic damage; slide 5; shift 5"
        },
        {
          "name": "Effect",
          "effect": "Each ally within distance can use Ready Rodent as a free triggered action once before the end of the round."
        }
      ]
    },
    {
      "type": "feature",
      "feature_type": "ability",
      "name": "Tempo Change",
      "icon": "🏹",
      "keywords": [
        "Magic",
        "Ranged"
      ],
      "usage": "Maneuver",
      "distance": "Ranged 10",
      "target": "Two enemies",
      "effects": [
        {
          "roll": "Power Roll + 3",
          "tier1": "P<1 Slowed (save ends)",
          "tier2": "P<2 Slowed (save ends)",
          "tier3": "P<3 Slowed (save ends)"
        },
        {
          "cost": "3 Malice",
          "effect": "Each ally within 3 of a target has their speed increased by 2 until the end of their next turn."
        }
      ]
    },
    {
      "type": "feature",
      "feature_type": "ability",
      "name": "Ever Ready Rodent",
      "icon": "❗️",
      "cost": "2 Malice",
      "keywords": [
        "Magic",
        "Melee",
        "Ranged"
      ],
      "usage": "Free Triggered action",
      "distance": "Ranged 5",
      "target": "One creature",
      "trigger": "The target deals damage to an ally or takes damage from an ally.",
      "effects": [
        {
          "name": "Effect",
          "effect": "The maestro makes a free strike against the target."
        }
      ]
    },
    {
      "type": "feature",
      "feature_type": "ability",
      "name": "Overture",
      "icon": "☠️",
      "ability_type": "Villain Action 1",
      "keywords": [
        "Area"
      ],
      "usage": "-",
      "distance": "10 burst",
      "target": "All allies in the burst",
      "effects": [
        {
          "name": "Effect",
          "effect": "Each target shifts up to their speed or takes the Defend main action."
        }
      ]
    },
    {
      "type": "feature",
      "feature_type": "ability",
      "name": "Solo Act",
      "icon": "☠️",
      "ability_type": "Villain Action 2",
      "keywords": [
        "Ranged"
      ],
      "usage": "-",
      "distance": "Ranged 15",
      "target": "One creature",
      "effects": [
        {
          "name": "Effect",
          "effect": "Until the end of their next turn, the target halves incoming damage, deals an additional 4 damage on strikes, and their speed is doubled."
        }
      ]
    },
    {
      "type": "feature",
      "feature_type": "ability",
      "name": "Rondo of Rat",
      "icon": "☠️",
      "ability_type": "Villain Action 3",
      "keywords": [
        "Area"
      ],
      "usage": "-",
      "distance": "10 burst",
      "target": "All dead allies in the burst",
      "effects": [
        {
          "name": "Effect",
          "effect": "Each target stands, makes a free strike, then collapses again. Allies of the targets can use Ready Rodent as a free triggered action once in conjunction with these free strikes."
        }
      ]
    }
  ]
}
