{
  "type": "statblock",
  "name": "DAME CORNELIA",
  "level": 1,
  "role": "",
  "organization": "LEADER",
  "keywords": [
    "Undead"
  ],
  "ev": "12",
  "stamina": "80",
  "immunities": [
    "Corruption 2",
    "Psychic 2"
  ],
  "speed": 5,
  "size": "1M",
  "stability": 2,
  "free_strike": 4,
  "might": 3,
  "agility": 2,
  "reason": 2,
  "intuition": 0,
  "presence": 2,
  "features": [
    {
      "type": "feature",
      "feature_type": "trait",
      "name": "End Effect",
      "icon": "⭐️",
      "effects": [
        {
          "effect": "At the end of her turn, Cornelia can take 5 damage to end one save ends effect affecting her. This damage can’t be reduced in any way."
        }
      ]
    },
    {
      "type": "feature",
      "feature_type": "trait",
      "name": "Death Void",
      "icon": "⭐️",
      "effects": [
        {
          "effect": "When Cornelia is destroyed, each enemy within 2 squares of her takes 5 corruption damage."
        }
      ]
    },
    {
      "type": "feature",
      "feature_type": "ability",
      "name": "Zweihander Swing",
      "icon": "❇️",
      "ability_type": "Signature Ability",
      "keywords": [
        "Area",
        "Melee",
        "Weapon"
      ],
      "usage": "Main action",
      "distance": "1 burst",
      "target": "All enemies in the burst",
      "effects": [
        {
          "roll": "Power Roll + 3",
          "tier1": "3 damage; M<1 slowed (save ends)",
          "tier2": "6 damage; M<2 slowed (save ends)",
          "tier3": "8 damage; M<3 slowed (save ends)"
        },
        {
          "name": "Effect",
          "effect": "An ally within 10 of Cornelia can make a free strike."
        },
        {
          "cost": "1 Malice",
          "effect": "The ally can use their signature action instead."
        }
      ]
    },
    {
      "type": "feature",
      "feature_type": "ability",
      "name": "You!",
      "icon": "🏹",
      "keywords": [
        "—"
      ],
      "usage": "Maneuver",
      "distance": "Ranged 10",
      "target": "One enemy",
      "effects": [
        {
          "name": "Effect",
          "effect": "The target is marked until the start of Cornelia’s next turn. Cornelia and each of her allies gain an edge on abilities used against targets marked by her."
        }
      ]
    },
    {
      "type": "feature",
      "feature_type": "ability",
      "name": "Parry!",
      "icon": "❗️",
      "keywords": [
        "—"
      ],
      "usage": "Triggered action",
      "distance": "Melee 1",
      "target": "Self or one ally",
      "trigger": "A creature targets the blackguard or an ally adjacent to Cornelia with a strike.",
      "effects": [
        {
          "name": "Effect",
          "effect": "The damage is halved."
        }
      ]
    },
    {
      "type": "feature",
      "feature_type": "ability",
      "name": "Advance!",
      "icon": "☠️",
      "ability_type": "Villain Action 1",
      "keywords": [
        "—"
      ],
      "usage": "-",
      "distance": "Self",
      "target": "Self",
      "effects": [
        {
          "name": "Effect",
          "effect": "Cornelia shifts up to her speed. During or after this movement, she can use Zweihander Swing twice."
        }
      ]
    },
    {
      "type": "feature",
      "feature_type": "ability",
      "name": "Back!",
      "icon": "☠️",
      "ability_type": "Villain Action 2",
      "keywords": [
        "Area",
        "Magic"
      ],
      "usage": "-",
      "distance": "5 burst",
      "target": "All enemies in the burst",
      "effects": [
        {
          "name": "Effect",
          "effect": "Slide 5."
        }
      ]
    },
    {
      "type": "feature",
      "feature_type": "ability",
      "name": "I Can Throw My Blade and So Should You!",
      "icon": "☠️",
      "ability_type": "Villain Action 3",
      "keywords": [
        "Area",
        "Magic",
        "Ranged",
        "Weapon"
      ],
      "usage": "-",
      "distance": "3 cube within 5",
      "target": "Each enemy in the cube",
      "effects": [
        {
          "name": "Effect",
          "effect": "Cornelia uses Zweihander Swing against each target. Then, each ally within 5 of the area can make a free strike against a target (one target per ally)."
        }
      ]
    }
  ]
}
