{
  "type": "statblock",
  "name": "GHOUL",
  "level": 1,
  "role": "HARRIER",
  "organization": "HORDE",
  "keywords": [
    "Undead"
  ],
  "ev": "3",
  "stamina": "15",
  "immunities": [
    "corruption 1",
    "poison 1"
  ],
  "speed": 7,
  "size": "1M",
  "stability": 0,
  "free_strike": 1,
  "might": 0,
  "agility": 2,
  "reason": -2,
  "intuition": 0,
  "presence": -1,
  "features": [
    {
      "type": "feature",
      "feature_type": "trait",
      "name": "Hunger",
      "icon": "⭐️",
      "effects": [
        {
          "effect": "If the ghoul charges, their speed increases by 2 until the end of their turn."
        }
      ]
    },
    {
      "type": "feature",
      "feature_type": "trait",
      "name": "Arise",
      "icon": "⭐️",
      "effects": [
        {
          "effect": "The first time the ghoul is reduced to Stamina 0 by damage that isn’t fire damage or holy damage and their body isn’t destroyed, they regain 1 Stamina and fall prone."
        }
      ]
    },
    {
      "type": "feature",
      "feature_type": "ability",
      "name": "Razor Claws",
      "icon": "🗡",
      "ability_type": "Signature Ability",
      "keywords": [
        "Charge",
        "Melee",
        "Strike",
        "Weapon"
      ],
      "usage": "Main action",
      "distance": "Melee 1",
      "target": "One creature or object",
      "effects": [
        {
          "roll": "Power Roll + 2",
          "tier1": "3 damage",
          "tier2": "4 damage",
          "tier3": "5 damage; M<2 bleeding (save ends)"
        }
      ]
    },
    {
      "type": "feature",
      "feature_type": "ability",
      "name": "Leap",
      "icon": "👤",
      "keywords": [
        "—"
      ],
      "usage": "Maneuver",
      "distance": "Self",
      "target": "Self",
      "effects": [
        {
          "name": "Effect",
          "effect": "The ghoul jumps 3 squares. If they land on a size 1 enemy, that enemy is knocked prone and the ghoul makes a free strike against them."
        }
      ]
    }
  ]
}
