{
  "type": "statblock",
  "name": "GOBLIN STINKER",
  "level": 1,
  "role": "CONTROLLER",
  "organization": "HORDE",
  "keywords": [
    "Goblin",
    "Humanoid"
  ],
  "ev": "3",
  "stamina": "10",
  "speed": 5,
  "movement": "climb",
  "size": "1S",
  "stability": 0,
  "free_strike": 1,
  "might": -2,
  "agility": 1,
  "reason": 0,
  "intuition": 0,
  "presence": 2,
  "features": [
    {
      "type": "feature",
      "feature_type": "trait",
      "name": "Crafty",
      "icon": "⭐️",
      "effects": [
        {
          "effect": "The stinker doesn’t provoke opportunity attacks by moving."
        }
      ]
    },
    {
      "type": "feature",
      "feature_type": "ability",
      "name": "Toxic Winds",
      "icon": "🔳",
      "ability_type": "Signature Ability",
      "keywords": [
        "Area",
        "Magic",
        "Ranged"
      ],
      "usage": "Main action",
      "distance": "3 cube within 15",
      "target": "Each enemy in the cube",
      "effects": [
        {
          "roll": "Power Roll + 2",
          "tier1": "1 poison damage; slide 1",
          "tier2": "2 poison damage; slide 2",
          "tier3": "3 poison damage; slide 3"
        },
        {
          "cost": "1+ Malice",
          "effect": "Increase the slide for one target by 1 square for each malice spent."
        }
      ]
    },
    {
      "type": "feature",
      "feature_type": "ability",
      "name": "Swamp Gas",
      "icon": "🔳",
      "keywords": [
        "Area",
        "Magic",
        "Ranged"
      ],
      "usage": "Maneuver",
      "distance": "3 cube within 10",
      "target": "Special",
      "effects": [
        {
          "name": "Effect",
          "effect": "The area is filled with a green haze until the start of the stinker’s next turn or until the stinker is reduced to Stamina 0. The area is difficult terrain for non-goblin creatures, and each such creature who moves within the area takes 2 poison damage for each square moved. The haze can’t be dispersed by wind."
        }
      ]
    }
  ]
}
