{
  "type": "statblock",
  "name": "Fossil Cryptic",
  "level": 2,
  "role": "",
  "organization": "Solo",
  "keywords": [
    "Elemental"
  ],
  "ev": "48",
  "stamina": "250",
  "speed": 8,
  "movement": "Burrow",
  "size": "1L",
  "stability": 3,
  "free_strike": 5,
  "might": 3,
  "agility": 2,
  "reason": 1,
  "intuition": 1,
  "presence": 0,
  "features": [
    {
      "type": "feature",
      "feature_type": "trait",
      "name": "Solo Monster",
      "icon": "☠️",
      "effects": [
        {
          "name": "End Effect",
          "effect": "At the end of each of their turns, the cryptic can take 5 damage to end one effect on them that can be ended by a saving throw. This damage can't be reduced in any way."
        },
        {
          "name": "Solo Turns",
          "effect": "The cryptic can take two turns each round. They can't take turns consecutively."
        }
      ]
    },
    {
      "type": "feature",
      "feature_type": "trait",
      "name": "Churning Trunk",
      "icon": "⭐️",
      "effects": [
        {
          "effect": "The cryptic is constantly surrounded by a 1 aura of swirling debris that obscures their form. Ranged abilities that target the cryptic take a bane. Additionally, any enemy who enters the aura for the first time in a round or starts their turn there takes 5 damage"
        }
      ]
    },
    {
      "type": "feature",
      "feature_type": "trait",
      "name": "Seismic Step",
      "icon": "⭐️",
      "effects": [
        {
          "effect": "The cryptic ignores difficult terrain. Additionally, they have line of effect to any creature with concealment if that creature is touching the ground."
        }
      ]
    },
    {
      "type": "feature",
      "feature_type": "ability",
      "name": "Sand Slam",
      "icon": "🗡",
      "ability_type": "Signature Ability",
      "keywords": [
        "Melee",
        "Strike",
        "Weapon"
      ],
      "usage": "Main action",
      "distance": "Melee 2",
      "target": "Two creatures or objects",
      "effects": [
        {
          "roll": "Power Roll + 3",
          "tier1": "8 damage; A < 1 slide 2",
          "tier2": "12 damage; A < 2 slide 2, prone",
          "tier3": "15 damage; A < 3 slide 3, prone and can't stand (EoT)"
        },
        {
          "name": "Effect",
          "effect": "If a target made prone this way is already prone, they are instead restrained (EoT)."
        }
      ]
    },
    {
      "type": "feature",
      "feature_type": "ability",
      "name": "Stone Bone Storm",
      "icon": "🔳",
      "keywords": [
        "Area"
      ],
      "usage": "Main action",
      "distance": "6 x 1 line within 1",
      "target": "Each enemy in the area",
      "effects": [
        {
          "roll": "Power Roll + 3",
          "tier1": "4 damage; M < 1 push 2",
          "tier2": "7 damage; M < 2 prone",
          "tier3": "10 damage; M < 3 prone"
        },
        {
          "name": "Effect",
          "effect": "The cryptic reforms their body and appears in an unoccupied space in the area."
        }
      ]
    },
    {
      "type": "feature",
      "feature_type": "ability",
      "name": "Stoneshift",
      "icon": "🏹",
      "keywords": [
        "Ranged"
      ],
      "usage": "Maneuver",
      "distance": "Ranged 5",
      "target": "One creature or object on the ground",
      "effects": [
        {
          "name": "Effect",
          "effect": "The cryptic slides the target up to 3 squares."
        },
        {
          "cost": "2 Malice",
          "effect": "The ability targets one additional target."
        }
      ]
    },
    {
      "type": "feature",
      "feature_type": "ability",
      "name": "Dissipate",
      "icon": "❗️",
      "cost": "1 Malice",
      "keywords": [
        "-"
      ],
      "usage": "Triggered action",
      "distance": "Self",
      "target": "Self",
      "trigger": "The cryptic takes damage.",
      "effects": [
        {
          "name": "Effect",
          "effect": "The cryptic halves the damage, ignores any nondamaging effects associated with it, and shifts up to 3 squares"
        }
      ]
    },
    {
      "type": "feature",
      "feature_type": "ability",
      "name": "Shatterstone",
      "icon": "❗️",
      "cost": "5 Malice",
      "keywords": [
        "Area"
      ],
      "usage": "Triggered action",
      "distance": "2 burst",
      "target": "Each enemy in the area",
      "trigger": "The cryptic uses the Dig maneuver to resurface.",
      "effects": [
        {
          "name": "Effect",
          "effect": "Before using the Dig maneuver, the cryptic moves up to their speed. They then create the burst when they breach the surface."
        },
        {
          "roll": "Power Roll + 3",
          "tier1": "4 damage; push 2",
          "tier2": "7 damage; push 3, prone",
          "tier3": "10 damage; push 4, prone"
        }
      ]
    },
    {
      "type": "feature",
      "feature_type": "ability",
      "name": "First Warning Quake",
      "icon": "☠️",
      "ability_type": "Villain Action 1",
      "keywords": [
        "Area"
      ],
      "usage": "-",
      "distance": "10 burst",
      "target": "Each enemy in the area",
      "effects": [
        {
          "name": "Special",
          "effect": "A target must be on the ground."
        },
        {
          "name": "Effect",
          "effect": "Each target makes a **Might test**.",
          "tier1": "Prone and can't stand (EoT)",
          "tier2": "Prone",
          "tier3": "No effect"
        }
      ]
    },
    {
      "type": "feature",
      "feature_type": "ability",
      "name": "Final Warning Fissure",
      "icon": "☠️",
      "ability_type": "Villain Action 2",
      "keywords": [
        "Area"
      ],
      "usage": "-",
      "distance": "5 burst",
      "target": "Each enemy in the area",
      "effects": [
        {
          "name": "Special",
          "effect": "A target must be on the ground."
        },
        {
          "name": "Effect",
          "effect": "The area drops 2 squares and is difficult terrain. Each target enemy falls, while each target ally drops safely. Additionally, each target enemy makes an **Agility test**.",
          "tier1": "9 damage; prone",
          "tier2": "5 damage",
          "tier3": "The target moves to the nearest unoccupied space outside the area."
        }
      ]
    },
    {
      "type": "feature",
      "feature_type": "trait",
      "name": "No Escape",
      "icon": "☠️",
      "ability_type": "Villain Action 3",
      "effects": [
        {
          "name": "Effect",
          "effect": "The cryptic makes an initial power roll that calls down stone pillars from the ceiling.",
          "features": [
            {
              "type": "feature",
              "feature_type": "ability",
              "keywords": [
                "Ranged"
              ],
              "usage": "-",
              "distance": "Ranged 10",
              "target": "Two creatures or objects",
              "effects": [
                {
                  "roll": "Power Roll + 3",
                  "tier1": "5 damage; prone; M < 1 restrained (save ends)",
                  "tier2": "9 damage; prone; M < 2 restrained (save ends)",
                  "tier3": "12 damage; prone; M < 3 restrained (save ends)"
                }
              ]
            }
          ]
        },
        {
          "effect": "The cryptic then makes a second power roll that raises stone pillars from the floor.",
          "features": [
            {
              "type": "feature",
              "feature_type": "ability",
              "keywords": [
                "Ranged"
              ],
              "usage": "-",
              "distance": "Ranged 10",
              "target": "Two creatures or objects",
              "effects": [
                {
                  "roll": "Power Roll + 3",
                  "tier1": "2 damage; vertical slide 2",
                  "tier2": "3 damage; vertical slide 4",
                  "tier3": "4 damage; vertical slide 6; if this movement brings the target into contact with the ceiling, they are restrained (save ends)."
                }
              ]
            }
          ]
        }
      ]
    }
  ]
}
