{
  "type": "statblock",
  "name": "ZOMBIE",
  "level": 1,
  "role": "BRUTE",
  "organization": "HORDE",
  "keywords": [
    "Undead"
  ],
  "ev": "3",
  "stamina": "20",
  "immunities": [
    "corruption 1",
    "poison 1"
  ],
  "speed": 5,
  "size": "1M",
  "stability": 1,
  "free_strike": 2,
  "might": 2,
  "agility": 1,
  "reason": -5,
  "intuition": -2,
  "presence": 1,
  "features": [
    {
      "type": "feature",
      "feature_type": "trait",
      "name": "Endless Knight",
      "icon": "⭐️",
      "effects": [
        {
          "effect": "The first time the zombie is reduced to Stamina 0 by damage that isn’t fire damage or holy damage and their body isn’t destroyed, they regain 10 Stamina and fall prone."
        }
      ]
    },
    {
      "type": "feature",
      "feature_type": "ability",
      "name": "Clobber and Clutch",
      "icon": "🗡",
      "ability_type": "Signature Ability",
      "keywords": [
        "Melee",
        "Strike",
        "Weapon"
      ],
      "usage": "Main action",
      "distance": "Melee 1",
      "target": "One creature or object",
      "effects": [
        {
          "roll": "Power Roll + 2",
          "tier1": "4 damage",
          "tier2": "6 damage",
          "tier3": "7 damage; grabbed"
        },
        {
          "name": "Effect",
          "effect": "A target who starts their turn grabbed by the zombie takes 2 corruption damage. If a creature takes 5 or more corruption damage this way, they become insatiably hungry for flesh. The target must complete the Find a Cure project to end this effect."
        }
      ]
    },
    {
      "type": "feature",
      "feature_type": "ability",
      "name": "Zombie Dust",
      "icon": "❇️",
      "cost": "3 Malice",
      "keywords": [
        "Area",
        "Melee"
      ],
      "usage": "Maneuver",
      "distance": "2 burst",
      "target": "Each enemy in the burst",
      "effects": [
        {
          "name": "Effect",
          "effect": "The zombie falls prone, expelling a wave of rot and dust."
        },
        {
          "roll": "Power Roll + 2",
          "tier1": "2 corruption damage",
          "tier2": "3 corruption damage; M<1 weakened (save ends)",
          "tier3": "4 corruption damage; M<2 dazed (save ends)"
        }
      ]
    }
  ]
}
