{
  "type": "statblock",
  "name": "RADENWIGHT REDEYE",
  "level": 1,
  "role": "ARTILLERY",
  "organization": "MINION",
  "keywords": [
    "Humanoid",
    "Radenwight"
  ],
  "ev": "3 for four minions",
  "stamina": "3",
  "speed": 5,
  "movement": "climb",
  "size": "1S",
  "stability": 0,
  "free_strike": 2,
  "with_captain": "Edge on strikes",
  "might": 1,
  "agility": 2,
  "reason": -1,
  "intuition": 0,
  "presence": 0,
  "features": [
    {
      "type": "feature",
      "feature_type": "ability",
      "name": "Eyes-On-Me Shot",
      "icon": "🏹",
      "ability_type": "Signature Ability",
      "keywords": [
        "Ranged",
        "Strike",
        "Weapon"
      ],
      "usage": "Main action",
      "distance": "Ranged 10",
      "target": "One creature or object per minion",
      "effects": [
        {
          "roll": "Power Roll + 2",
          "tier1": "2 damage",
          "tier2": "4 damage",
          "tier3": "5 damage"
        },
        {
          "name": "Effect",
          "effect": "An ally of the redeye within 2 squares of the target can shift up to 2 squares."
        }
      ]
    },
    {
      "type": "feature",
      "feature_type": "ability",
      "name": "Ready Rodent",
      "icon": "❗️",
      "keywords": [
        "Melee",
        "Weapon"
      ],
      "usage": "Triggered action",
      "distance": "Melee 1",
      "target": "One creature",
      "trigger": "An ally deals damage to the target.",
      "effects": [
        {
          "name": "Effect",
          "effect": "The redeye makes a free strike against the target."
        }
      ]
    }
  ]
}
