{
  "type": "statblock",
  "name": "HUMAN BRAWLER",
  "level": 1,
  "role": "BRUTE",
  "organization": "PLATOON",
  "keywords": [
    "Human",
    "Humanoid"
  ],
  "ev": "6",
  "stamina": "40",
  "immunities": [
    "Corruption 1",
    "Psychic 1"
  ],
  "speed": 5,
  "size": "1M",
  "stability": 0,
  "free_strike": 4,
  "might": 2,
  "agility": 1,
  "reason": 0,
  "intuition": 0,
  "presence": 0,
  "features": [
    {
      "type": "feature",
      "feature_type": "trait",
      "name": "Shoot the Hostage",
      "icon": "⭐️",
      "effects": [
        {
          "effect": "The brawler takes half damage from strikes if they have a creature or object grabbed. The grabbed creature or object takes the other half of the damage."
        }
      ]
    },
    {
      "type": "feature",
      "feature_type": "trait",
      "name": "Supernatural Insight",
      "icon": "⭐️",
      "effects": [
        {
          "effect": "The brawler ignores concealment if it’s granted by a supernatural effect, or the target is supernatural."
        }
      ]
    },
    {
      "type": "feature",
      "feature_type": "ability",
      "name": "Haymaker",
      "icon": "🗡",
      "ability_type": "Signature Ability",
      "keywords": [
        "Melee",
        "Strike",
        "Weapon"
      ],
      "usage": "Main action",
      "distance": "Melee 1",
      "target": "One creature or object",
      "effects": [
        {
          "roll": "Power Roll + 2",
          "tier1": "6 damage",
          "tier2": "9 damage",
          "tier3": "12 damage; M<2 grabbed, target has a bane on escaping the grab"
        },
        {
          "name": "Effect",
          "effect": "brawler deals an additional 2 damage if the target is already grabbed."
        }
      ]
    },
    {
      "type": "feature",
      "feature_type": "ability",
      "name": "Throw",
      "icon": "🗡",
      "cost": "1 Malice",
      "keywords": [
        "—"
      ],
      "usage": "Maneuver",
      "distance": "Melee 1",
      "target": "One creature grabbed by the brawler",
      "effects": [
        {
          "name": "Effect",
          "effect": "Push 5."
        }
      ]
    }
  ]
}
