{
  "type": "statblock",
  "name": "MARA",
  "level": 2,
  "role": "CONTROLLER",
  "organization": "ELITE",
  "keywords": [
    "Humanoid",
    "Human",
    "Rival"
  ],
  "ev": "16",
  "stamina": "60",
  "speed": 5,
  "size": "1M",
  "stability": 1,
  "free_strike": 5,
  "might": 0,
  "agility": 0,
  "reason": 2,
  "intuition": 1,
  "presence": 0,
  "features": [
    {
      "type": "feature",
      "feature_type": "trait",
      "name": "Determination",
      "icon": "⭐️",
      "effects": [
        {
          "effect": "If Mara is frightened, slowed, or weakened, she can use a maneuver to end the condition."
        }
      ]
    },
    {
      "type": "feature",
      "feature_type": "trait",
      "name": "Rivalry",
      "icon": "⭐️",
      "effects": [
        {
          "effect": "Mara selects one creature within line of effect at the start of an encounter. Both Mara and the creature can add a 1d3 to all power rolls made against each other."
        }
      ]
    },
    {
      "type": "feature",
      "feature_type": "ability",
      "name": "The Writhing Green",
      "icon": "🏹",
      "ability_type": "Signature Ability",
      "keywords": [
        "Green",
        "Magic",
        "Ranged",
        "Strike"
      ],
      "usage": "Main action",
      "distance": "Ranged 10",
      "target": "Two creatures or objects",
      "effects": [
        {
          "roll": "Power Roll + 2",
          "tier1": "7 damage; slide 1",
          "tier2": "10 damage; slide 2",
          "tier3": "13 damage; slide 3"
        }
      ]
    },
    {
      "type": "feature",
      "feature_type": "ability",
      "name": "The Earth Devours",
      "icon": "🔳",
      "cost": "3 Malice",
      "keywords": [
        "Area",
        "Green",
        "Magic"
      ],
      "usage": "Main action",
      "distance": "3 cube within 10",
      "target": "All enemies in the cube",
      "effects": [
        {
          "roll": "Power Roll + 2",
          "tier1": "3 damage",
          "tier2": "5 damage; restrained (EoT)",
          "tier3": "8 damage; restrained (save ends)"
        },
        {
          "name": "Effect",
          "effect": "The affected area is difficult terrain for enemies. An enemy has acid weakness 2 while occupying an affected square."
        }
      ]
    },
    {
      "type": "feature",
      "feature_type": "ability",
      "name": "Jaws of the Void",
      "icon": "❗️",
      "keywords": [
        "Magic",
        "Void"
      ],
      "usage": "Triggered action",
      "distance": "Self",
      "target": "Self",
      "trigger": "Mara takes damage.",
      "effects": [
        {
          "name": "Effect",
          "effect": "Mara teleports 2 squares. Each creature adjacent to her original space takes 2 corruption damage."
        }
      ]
    }
  ]
}
