{
  "type": "statblock",
  "name": "GOREK",
  "level": 2,
  "role": "BRUTE",
  "organization": "ELITE",
  "keywords": [
    "Humanoid",
    "Dwarf",
    "Rival"
  ],
  "ev": "16",
  "stamina": "100",
  "speed": 5,
  "size": "1M",
  "stability": 2,
  "free_strike": 5,
  "might": 2,
  "agility": 1,
  "reason": 0,
  "intuition": 0,
  "presence": 0,
  "features": [
    {
      "type": "feature",
      "feature_type": "trait",
      "name": "Overwhelm",
      "icon": "⭐️",
      "effects": [
        {
          "effect": "Once per turn, when Gorek force moves a target or shifts into a square adjacent to a creature or object, he can make a free strike against them."
        }
      ]
    },
    {
      "type": "feature",
      "feature_type": "trait",
      "name": "Great Fortitude",
      "icon": "⭐️",
      "effects": [
        {
          "effect": "Gorek can’t be weakened."
        }
      ]
    },
    {
      "type": "feature",
      "feature_type": "trait",
      "name": "Rivalry",
      "icon": "⭐️",
      "effects": [
        {
          "effect": "Gorek selects one creature within line of effect at the start of an encounter. Both Gorek and the creature can add a 1d3 to all power rolls made against each other."
        }
      ]
    },
    {
      "type": "feature",
      "feature_type": "ability",
      "name": "Brutal Impact",
      "icon": "🗡",
      "ability_type": "Signature Ability",
      "keywords": [
        "Melee",
        "Strike",
        "Weapon"
      ],
      "usage": "Main action",
      "distance": "Melee 1",
      "target": "Two creatures or objects",
      "effects": [
        {
          "roll": "Power Roll + 2",
          "tier1": "7 damage; push 1",
          "tier2": "11 damage; push 2",
          "tier3": "14 damage; push 3"
        },
        {
          "cost": "2 Malice",
          "effect": "Each target is M<1 slowed (save ends)."
        }
      ]
    },
    {
      "type": "feature",
      "feature_type": "ability",
      "name": "Let’s Tussle",
      "icon": "🗡",
      "cost": "2 Malice",
      "keywords": [
        "Melee",
        "Strike",
        "Weapon"
      ],
      "usage": "Main action",
      "distance": "Melee 1",
      "target": "One creature the fury’s size or smaller",
      "effects": [
        {
          "roll": "Power Roll + 2",
          "tier1": "8 damage; M<0 grabbed",
          "tier2": "13 damage; M<1 grabbed",
          "tier3": "16 damage; M<2 grabbed"
        },
        {
          "name": "Effect",
          "effect": "Gorek has an edge on strikes against a grabbed creature."
        }
      ]
    }
  ]
}
